{
  "protocol_version": 1,
  "workspace": "/workspace",
  "template": {
    "id": "umami",
    "catalogue_digest": "sha256:aaaaaaaaaaaaaaaaaaaaaaaaaaaaaaaaaaaaaaaaaaaaaaaaaaaaaaaaaaaaaaaa",
    "manifest_digest": "sha256:bbbbbbbbbbbbbbbbbbbbbbbbbbbbbbbbbbbbbbbbbbbbbbbbbbbbbbbbbbbbbbbb",
    "plugin_digest": "sha256:cccccccccccccccccccccccccccccccccccccccccccccccccccccccccccccccc",
    "upstream_repository": "https://github.com/umami-software/umami",
    "upstream_commit": "ca661c7057984aa98ed4f7083d84dae2f65bfcb0"
  },
  "deployment": {
    "preset": "next",
    "capabilities": ["deployment.migration.controlled", "service.postgres"]
  },
  "services": [
    {
      "key": "database",
      "kind": "postgres",
      "bindings": [{ "environment": "DATABASE_URL", "output": "connection_url" }]
    }
  ],
  "user_inputs": [
    { "key": "public_url", "type": "url", "environment": "PUBLIC_URL", "required": false }
  ],
  "generated_inputs": [
    { "key": "app_secret", "generator": "random_base64url", "bytes": 32, "environment": "APP_SECRET" }
  ]
}
